Rank,Sourceid,Title,SJR,SJR Best Quartile,URL,Scope
397,21100434606,"""Sexual Medicine""",0.513,Q3,https://www.scimagojr.com/journalsearch.php?q=21100434606&tip=sid&clean=0,"an official publication of the international society for sexual medicine, sexual medicine publishes multidisciplinary clinical, basic, and epidemiological research to define and understand the basis of sexual function and dysfunction in diverse populations. sexual medicine welcomes manuscripts on basic anatomy and physiology pertaining to human sexuality, pharmacology, clinical management of sexual dysfunction, epidemiological studies in sexuality, psychosexual and interpersonal dimensions of human sexuality, clinical trials, and other articles of interest to clinicians and researchers interested in human sexuality. the open access format of sexual medicine ensures that accepted manuscripts will be rapidly published and fully accessible by interested healthcare professionals worldwide.

sexual medicine’s emphasis on papers relevant to specific populations distinguishes it from the journal of sexual medicine, which will continue to publish manuscripts on issues of general interest to sexual medicine practitioners worldwide, and sexual medicine reviews, which publishes systematic reviews of controversial topics in sexual medicine."
398,7100153145,"""Developmental Neurorehabilitation""",0.506,Q4,https://www.scimagojr.com/journalsearch.php?q=7100153145&tip=sid&clean=0,"developmental neurorehabilitation aims to enhance recovery, rehabilitation and education of people with brain injury, neurological disorders, and other developmental, physical and intellectual disabilities. although there is an emphasis on childhood, developmental disability can be considered from a lifespan perspective. this perspective acknowledges that development occurs throughout a person’s life and thus a range of impairments or diseases can cause a disability that can affect development at any stage of life."
399,21100945706,"""Multimodal Technologies and Interaction""",0.506,Q3,https://www.scimagojr.com/journalsearch.php?q=21100945706&tip=sid&clean=0,"•	displays/sensors: visual, tactile/haptic, sonic, taste, smell
•	multimodal interaction, interfaces, and communication
•	human–computer and human–robot relations and interaction
•	animal–computer interaction
•	human factors, cognition
•	multimodal perception
•	smart wearable technology
•	psychology and neuroscience
•	digital and sensory marketing
•	enabling, disruptive technologies
•	multimodal science, technology and interfaces
•	theoretical, social and cultural issues
•	design and evaluation
•	content creation, environments processes and methods
•	application domains"
400,19900191993,"""Journal of Visualized Experiments""",0.504,Q3,https://www.scimagojr.com/journalsearch.php?q=19900191993&tip=sid&clean=0,jove publishes novel and gold standard research methodologies in both the physical and life sciences.
401,21100805775,"""International Journal of Design Creativity and Innovation""",0.503,Q3,https://www.scimagojr.com/journalsearch.php?q=21100805775&tip=sid&clean=0,"the international journal of design creativity and innovation is an international publication that provides a forum for discussing the nature and potential of creativity and innovation in design from both theoretical and practical perspectives. 

design creativity and innovation is truly an interdisciplinary academic research field that will interest and stimulate researchers of engineering design, industrial design, architecture, art, and similar areas. the journal aims to not only promote existing research disciplines but also pioneer a new one that lies in the intermediate area between the domains of systems engineering, information technology, computer science, social science, artificial intelligence, cognitive science, psychology, philosophy, linguistics, and related fields. 
the journal covers, but is not restricted to, the following topics: 

·theories on design creativity and innovation 
·cognition of design creativity 
·innovative process 
·inventive process 
·analogical reasoning for design creativity and innovation 
·design synthesis 
·method and tools for design creativity and innovation 
·representation of design creativity and innovation 
·education for design creativity and innovation
·concept generation and inspiration."
402,21100396040,"""Dementia and Geriatric Cognitive Disorders Extra""",0.502,Q3,https://www.scimagojr.com/journalsearch.php?q=21100396040&tip=sid&clean=0,"this open access and online-only journal publishes original articles covering the entire spectrum of cognitive dysfunction such as alzheimer’s and parkinson’s disease, huntington’s chorea and other neurodegenerative diseases. 
the journal draws from diverse related research disciplines such as psychogeriatrics, neuropsychology, clinical neurology, morphology, physiology, genetic molecular biology, pathology, biochemistry, immunology, pharmacology and pharmaceutics. strong emphasis is placed on the publication of research findings from animal studies which are complemented by clinical and therapeutic experience to give an overall appreciation of the field. 
dementia and geriatric cognitive disorders extra provides additional contents based on reviewed and accepted submissions to the main journal dementia and geriatric cognitive disorders extra ."
403,17100154713,"""Prion""",0.501,Q4,https://www.scimagojr.com/journalsearch.php?q=17100154713&tip=sid&clean=0,"prion is the first international peer-reviewed open access journal to focus exclusively on protein folding and misfolding, protein assembly disorders, protein-based and structural inheritance. the goal is to foster communication and rapid exchange of information through timely publication of important results using traditional as well as electronic formats. the overriding criteria for publication in prion are originality, scientific merit and general interest."
404,18022,"""NeuroReport""",0.499,Q3,https://www.scimagojr.com/journalsearch.php?q=18022&tip=sid&clean=0,"neuroreport is a channel for rapid communication of new findings in neuroscience. it is a forum for the publication of short but complete reports of important studies that require very fast publication. papers are accepted on the basis of the novelty of their finding, on their significance for neuroscience and on a clear need for rapid publication. preliminary communications are not suitable for the journal. submitted articles undergo a preliminary review by the editor. some articles may be returned to authors without further consideration. those being considered for publication will undergo further assessment and peer-review by the editors and those invited to do so from a reviewer pool.

the core interest of the journal is on studies that cast light on how the brain (and the whole of the nervous system) works.

we aim to give authors a decision on their submission within 2-5 weeks, and all accepted articles appear in the next issue to press."
405,12798,"""Perceptual and Motor Skills""",0.498,Q3,https://www.scimagojr.com/journalsearch.php?q=12798&tip=sid&clean=0,"the purpose of perceptual and motor skills is to encourage scientific originality and creativity in the fields of perception, learning, and motor skills. experimental or theoretical articles are welcomed. perceptual and motor skills will assign manuscripts into three major sections, each with two subsections: human development (biological/environmental), clinical problems (assessment/intervention), and peak performance (sports/learning)."
406,23481,"""Journal of Vestibular Research: Equilibrium and Orientation""",0.489,Q3,https://www.scimagojr.com/journalsearch.php?q=23481&tip=sid&clean=0,"journal of vestibular research is a peer-reviewed journal that publishes experimental and observational studies, review papers, and theoretical papers based on current knowledge of the vestibular system. subjects of the studies can include experimental animals, normal humans, and humans with vestibular or other related disorders. study topics can include the following:

anatomy of the vestibular system, including vestibulo-ocular, vestibulo-spinal, and vestibulo-autonomic pathways
balance disorders
neurochemistry and neuropharmacology of balance, both at the systems and single neuron level
neurophysiology of balance, including the vestibular, ocular motor, autonomic, and postural control systems
psychophysics of spatial orientation
space and motion sickness
vestibular rehabilitation
vestibular-related human performance in various environments"
407,21100455212,"""Biomedical Reports""",0.488,Q3,https://www.scimagojr.com/journalsearch.php?q=21100455212&tip=sid&clean=0,"biomedical reports is a monthly, peer-reviewed journal, dedicated to publishing research across all fields of biology and medicine, including pharmacology, pathology, gene therapy, genetics, microbiology, neurosciences, infectious diseases, molecular cardiology and molecular surgery. the journal provides a home for original research, case reports and review articles."
408,14182,"""NeuroSignals""",0.487,Q3,https://www.scimagojr.com/journalsearch.php?q=14182&tip=sid&clean=0,"neurosignals is an international journal dedicated to publishing original articles and reviews in the field of neuronal communication. novel findings related to signaling molecules, channels and transporters, pathways and networks that are associated with development and function of the nervous system are welcome. the scope of the journal includes genetics, molecular biology, bioinformatics, (patho)physiology, (patho)biochemistry, pharmacology & toxicology, imaging and clinical neurology & psychiatry. reported observations should significantly advance our understanding of neuronal signaling in health & disease and be presented in a format applicable to an interdisciplinary readership."
409,14836,"""Canadian Journal of Neurological Sciences""",0.486,Q3,https://www.scimagojr.com/journalsearch.php?q=14836&tip=sid&clean=0,"the canadian journal of neurological sciences (cjns) is a widely circulated, internationally recognized medical journal that publishes peer-reviewed articles in neurology and neurosciences.  articles are published in english with abstracts in both english and french. the journal is published in january, march, may, july, september, and november in an online format.
  the journal is the official publication of the five member societies of the canadian neurological sciences federation (cnsf) -- canadian neurological society (cns), canadian association of child neurology (cacn), canadian neurosurgical society (cnss), canadian society of clinical neurophysiologists (cscn) and the canadian society of neuroradiology (csnr)."
410,16818,"""Journal of Sensory Studies""",0.485,Q3,https://www.scimagojr.com/journalsearch.php?q=16818&tip=sid&clean=0,"the journal of sensory studies publishes original research and review articles, as well as expository and tutorial papers focusing on observational and experimental studies that lead to development and application of sensory and consumer (including behavior) methods to products such as food and beverage, medical, agricultural, biological, pharmaceutical, cosmetics, or other materials; information such as marketing and consumer information; or improvement of services based on sensory methods. all papers should show some advancement of sensory science in terms of methods. the journal does not publish papers that focus primarily on the application of standard sensory techniques to experimental variations in products unless the authors can show a unique application of sensory in an unusual way or in a new product category where sensory methods usually have not been applied."
411,21100332455,"""Journal of Huntington's disease""",0.481,Q4,https://www.scimagojr.com/journalsearch.php?q=21100332455&tip=sid&clean=0,"the journal of huntington's disease is an international multidisciplinary journal to facilitate progress in understanding the genetics, molecular correlates, pathogenesis, pharmacology, diagnosis and treatment of huntington's disease and related disorders. the journal publishes research reports, reviews, short communications, letters-to-the-editor, and will consider research that has negative findings. the journal is dedicated to providing an open forum for original research in basic science, translational research and clinical medicine that will expedite our fundamental understanding and improve treatment of huntington's disease and related disorders."
412,21100243801,"""Multisensory Research""",0.48,Q3,https://www.scimagojr.com/journalsearch.php?q=21100243801&tip=sid&clean=0,"multisensory research is an interdisciplinary archival journal covering all aspects of multisensory processing including the control of action, cognition and attention. research using any approach to increase our understanding of multisensory perceptual, behavioural, neural and computational mechanisms is encouraged. empirical, neurophysiological, psychophysical, brain imaging, clinical, developmental, mathematical and computational analyses are welcome. research will also be considered covering multisensory applications such as sensory substitution, crossmodal methods for delivering sensory information or multisensory approaches to robotics and engineering. short communications and technical notes that draw attention to new developments will be included, as will reviews and commentaries on current issues. special issues dealing with specific topics will be announced from time to time. multisensory research is a continuation of seeing and perceiving, and of spatial vision."
413,12100155713,"""Mental Lexicon""",0.477,Q3,https://www.scimagojr.com/journalsearch.php?q=12100155713&tip=sid&clean=0,"the mental lexicon is an interdisciplinary journal that provides an international forum for research that bears on the issues of the representation and processing of words in the mind and brain. we encourage both the submission of original research and reviews of significant new developments in the understanding of the mental lexicon. the journal publishes work that includes, but is not limited to the following:
models of the representation of words in the mind
computational models of lexical access and production
experimental investigations of lexical processing
neurolinguistic studies of lexical impairment.
functional neuroimaging and lexical representation in the brain
lexical development across the lifespan
lexical processing in second language acquisition
the bilingual mental lexicon
lexical and morphological structure across languages
formal models of lexical structure
corpus research on the lexicon
new experimental paradigms and statistical techniques for mental lexicon research."
414,21100215180,"""Neurology Research International""",0.463,Q3,https://www.scimagojr.com/journalsearch.php?q=21100215180&tip=sid&clean=0,"neurology research international is a peer-reviewed, open access journal that publishes original research articles, review articles, and clinical studies focusing on diseases of the nervous system, as well as normal neurological functioning. the journal will consider basic, translational, and clinical research, including animal models and clinical trials."
415,130113,"""Cognitive Processing""",0.462,Q3,https://www.scimagojr.com/journalsearch.php?q=130113&tip=sid&clean=0,"cognitive processing - international quarterly of cognitive science is a peer-reviewed international journal that publishes innovative contributions in the multidisciplinary field of cognitive science.
its first aim is to present the latest results obtained in the manifold disciplines concerned with the different aspects of cognitive processing in natural and artificial systems: artificial intelligence, computer science and knowledge engineering, linguistics, mathematics, neuroscience, philosophy and cognitive anthropology, psychology, robotics.
its main purpose is to stimulate research and scientific interaction through communication between specialists in different fields on topics of common interest and to promote an interdisciplinary understanding of the diverse topics in contemporary cognitive science.
cognitive processing considers diverse subject matter concerning cognitive processing, accepting various approaches to investigation: theoretical, experimental, methodological, computational and modeling, applicative. a tentative list of topics includes: action; attention; cognitive change and optimization; computation in cognitive science; connectionist approaches; expertise; knowledge acquisition; knowledge representation; language (grammar and semantics, discourse analysis, development, disturbances); mental architectures and models; memory; mind design; multimedia databases; perception and pattern recognition."
416,19700183044,"""Thyroid Research""",0.462,Q4,https://www.scimagojr.com/journalsearch.php?q=19700183044&tip=sid&clean=0,"thyroid research is an online journal that aims to present the newest knowledge related to thyroid hormones, thyroid diseases and any related fields. the journal’s regular readership includes researchers, clinicians and healthcare providers across the world.

thyroid research encompasses a wide range of thyroidology topics including, diagnosis, pharmacological and other treatment methods, invasive treatment, physiological mechanisms of thyroid hormone action and regulation, immunological aspects, genetics, new guidelines in disease management, thyroid related diseases and complications."
417,21100837404,"""Adaptive Human Behavior and Physiology""",0.461,Q3,https://www.scimagojr.com/journalsearch.php?q=21100837404&tip=sid&clean=0,"adaptive human behavior and physiology is an international interdisciplinary scientific journal that publishes theoretical and empirical studies of any aspects of adaptive human behavior (e.g. cooperation, affiliation, and bonding, competition and aggression, sex and relationships, parenting, decision-making), with emphasis on studies that also address the biological (e.g. neural, endocrine, immune, cardiovascular, genetic) mechanisms controlling behavior."
418,130017,"""Current Neurovascular Research""",0.459,Q3,https://www.scimagojr.com/journalsearch.php?q=130017&tip=sid&clean=0,"current neurovascular research provides a cross platform for the publication of scientifically rigorous research that addresses disease mechanisms of both neuronal and vascular origins in neuroscience. the journal serves as an international forum publishing novel and original work as well as timely neuroscience research articles, full-length/mini reviews in the disciplines of cell developmental disorders, plasticity, and degeneration that bridges the gap between basic science research and clinical discovery. current neurovascular research emphasizes the elucidation of disease mechanisms, both cellular and molecular, which can impact the development of unique therapeutic strategies for neuronal and vascular disorders."
419,12795,"""Perception""",0.458,Q4,https://www.scimagojr.com/journalsearch.php?q=12795&tip=sid&clean=0,"perception is a traditional print journal covering all areas of the perceptual sciences, but with a strong historical emphasis on perceptual illusions. perception is a subscription journal, free for authors to publish their research as a standard article, short report or short & sweet. the journal also publishes editorials and book reviews."
420,12108,"""Behavioral and Brain Sciences""",0.456,Q4,https://www.scimagojr.com/journalsearch.php?q=12108&tip=sid&clean=0,"bbs is the internationally renowned journal with the innovative format known as open peer commentary. particularly significant and controversial pieces of work are published from researchers in any area of psychology, neuroscience, behavioral biology or cognitive science, together with 20-40 commentaries on each article from specialists within and across these disciplines, plus the author's response to them. the result is a fascinating and unique forum for the communication, criticism, stimulation, and particularly the unification of research in behavioral and brain sciences from molecular neurobiology to artificial intelligence and the philosophy of the mind."
421,19700172802,"""Dementia e Neuropsychologia""",0.455,Q3,https://www.scimagojr.com/journalsearch.php?q=19700172802&tip=sid&clean=0,"dementia top neuropsychologia the official scientific journal of the cognitive neurology and ageing department of the brazilian academy of neurology and of the brazilian association of geriatric neuropsychiatry, is published by the ""associação neurologia cognitiva e do comportamento"", a nonprofit brazilian association. regularly published on march, june, september, and december since 2007."
422,12030,"""Learning and Behavior""",0.455,Q4,https://www.scimagojr.com/journalsearch.php?q=12030&tip=sid&clean=0,"learning & behavior publishes experimental and theoretical contributions and critical reviews concerning fundamental processes of learning and behavior in nonhuman and human animals. topics covered include sensation, perception, conditioning, learning, attention, memory, motivation, emotion, development, social behavior, and comparative investigations."
423,16675,"""Journal of Clinical Neurophysiology""",0.454,Q3,https://www.scimagojr.com/journalsearch.php?q=16675&tip=sid&clean=0,"​the journal of clinical neurophysiology features both topical reviews and original research in both central and peripheral neurophysiology, as related to patient evaluation and treatment.

official journal of the american clinical neurophysiology society."
424,21100901222,"""Concussion""",0.451,Q3,https://www.scimagojr.com/journalsearch.php?q=21100901222&tip=sid&clean=0,"concussion is an open access journal from the drake foundation, published by future science group. the journal publishes original research, reviews and commentaries addressing the assessment, management, and short- and long-term implications of concussion.

concussion is a subset of traumatic brain injury that occurs after a blow or other injury to the head. it has been defined by the concussion in sport group as ""a complex pathophysiological process affecting the brain, induced by biomechanical forces.""

exciting developments in the field of biomarker research are shedding new light on how to gauge the severity of concussion immediately after injury, as well as indicating future prognosis. the ongoing and future development of tools and point-of-care tests based on this research will help to ensure appropriate management from the moment of injury and into the long term.

the journal highlights significant advances in basic, translational and clinical research, and places them in context for the future.

topics covered include:

studies and trials in concussion
biomarkers for assessment and predicting adverse effects
optimum biomarker selection, validation and application
management, including return-to-play decisions in sports
pathogenesis
pathology
prognosis."
425,21100210905,"""i-Perception""",0.451,Q4,https://www.scimagojr.com/journalsearch.php?q=21100210905&tip=sid&clean=0,"i-perception is an open access journal, well suited to publishing in emerging fields of perceptual research where movies and on-line demonstrations are essential, such as studies of motion, virtual reality, colour, visual arts and empirical aesthetics. authors can publish their research as a standard article, short report or short & sweet. i-perception also publishes translations of key historical papers, special issues, journal club and i-reviews."
426,24578,"""Mathematical Medicine and Biology""",0.45,Q3,https://www.scimagojr.com/journalsearch.php?q=24578&tip=sid&clean=0,"formerly the ima journal of mathematics applied in medicine and biology.

mathematical medicine and biology publishes original articles with a significant mathematical content addressing topics in medicine and biology. papers exploiting modern developments in applied mathematics are particularly welcome. the biomedical relevance of mathematical models should be demonstrated clearly and validation by comparison against experiment is strongly encouraged.

the journal welcomes contributions relevant to any area of the life sciences including:

-biomechanics-
biophysics-
cell biology-
developmental biology-
ecology and the environment-
epidemiology-
immunology-
infectious diseases-
neuroscience-
pharmacology-
physiology-
population biology"
