Rank,Sourceid,Title,SJR,SJR Best Quartile,URL,Scope
268,17462,"""Neuropsychoanalysis""",0.827,Q2,https://www.scimagojr.com/journalsearch.php?q=17462&tip=sid&clean=0,"neuropsychoanalysis publishes papers at the intersection of psychoanalysis and the neurosciences. our journal was founded on the assumption that these two historically divided disciplines are ultimately pursuing the same task, namely, 'attempt[ing] to make the complications of mental functioning intelligible by dissecting the function and assigning its different constituents to different component parts of the [mental] apparatus' (freud, 1900a, p. 536).  although the fields have approached this task from radically different perspectives, the underlying commonalities have become increasingly evident as neuroscientists have begun to investigate those 'complications of mental functioning' that were traditionally the preserve of psychoanalysts, such as emotion, unconscious cognition, and interpersonal processes. neuropsychoanalysis provides an arena for integrating the explosion of neuroscientific insights into existing psychoanalytic theories and models, and for enriching behavioral and cognitive neuroscience, neurology, neuropsychology and related fields with the dynamic perspectives of psychoanalytic thought and practice.

we welcome experimental, clinical or theoretical papers that take into account both mind and brain.  more specifically, papers that emphasize the integration of the dynamic, intrapsychic or interpersonal world of subjectivity and mental life, either conscious or unconscious, on the one hand, and the objective measurements or manipulations of brain structure or function, on the other hand, are invited.  submissions are subject to double-blind peer review before they are accepted for publication.  in addition, target papers on selected topics are solicited from leading researchers, and published together with invited commentaries from both psychoanalytic and neuroscientific peers."
269,144733,"""Phenomenology and the Cognitive Sciences""",0.821,Q3,https://www.scimagojr.com/journalsearch.php?q=144733&tip=sid&clean=0,"phenomenology and the cognitive sciences is an interdisciplinary, international journal that serves as a forum to explore the intersections between phenomenology, empirical science, and analytic philosophy of mind.

the journal represents an attempt to build bridges between continental phenomenological approaches (in the tradition following husserl) and disciplines that have not always been open to or aware of phenomenological contributions to understanding cognition and related topics. the journal welcomes contributions by phenomenologists, scientists, and philosophers who study cognition, broadly defined to include issues that are open to both phenomenological and empirical investigation, including perception, emotion, language, and so forth. in addition the journal welcomes discussions of methodological issues that involve the variety of approaches appropriate for addressing these problems.

phenomenology and the cognitive sciences also publishes critical review articles that address recent work in areas relevant to the connection between empirical results in experimental science and first-person perspective."
270,13625,"""Audiology and Neuro-Otology""",0.82,Q2,https://www.scimagojr.com/journalsearch.php?q=13625&tip=sid&clean=0,"'audiology and neurotology' provides a forum for the publication of the most-advanced and rigorous scientific research related to the basic science and clinical aspects of the auditory and vestibular system and diseases of the ear. this journal seeks submission of cutting edge research opening up new and innovative fields of study that may improve our understanding and treatment of patients with disorders of the auditory and vestibular systems, their central connections and their perception in the central nervous system.
in addition to original papers the journal also offers invited review articles on current topics written by leading experts in the field.
the journal is of primary importance for all scientists and practitioners interested in audiology, otology and neurotology, auditory neurosciences and related disciplines."
271,17997,"""Neurophysiologie Clinique""",0.819,Q2,https://www.scimagojr.com/journalsearch.php?q=17997&tip=sid&clean=0,"neurophysiologie clinique / clinical neurophysiology (nccn) is the official organ of the french society of clinical neurophysiology (snclf). this journal is published 6 times a year, and is aimed at an international readership, with articles written in english. these can take the form of original research papers, comprehensive review articles, viewpoints, short communications, technical notes, editorials or letters to the editor. the theme is the neurophysiological investigation of central or peripheral nervous system or muscle in healthy humans or patients. the journal focuses on key areas of clinical neurophysiology: electro- or magneto-encephalography, evoked potentials of all modalities, electroneuromyography, sleep, pain, posture, balance, motor control, autonomic nervous system, cognition, invasive and non-invasive neuromodulation, signal processing, bio-engineering, functional imaging."
272,23377,"""Chemical Senses""",0.817,Q2,https://www.scimagojr.com/journalsearch.php?q=23377&tip=sid&clean=0,chemical senses publishes original research and review papers on all aspects of chemoreception in both humans and animals. an important part of the journal's coverage is devoted to techniques and the development and application of new methods for investigating chemoreception and chemosensory structures.
273,18730,"""Psychiatry Research - Neuroimaging""",0.817,Q2,https://www.scimagojr.com/journalsearch.php?q=18730&tip=sid&clean=0,"psychiatry research: neuroimaging, a companion title to psychiatry research, focuses on publications relating to imaging techniques. we publish manuscripts on magnetic resonance imaging, positron emission tomography, multichannel electrophysiology, near-infrared spectroscopy, computed tomography, magnetoencephalography, non-invasive brain stimulation, autoradiography, post-mortem regional analyses, and other imaging techniques. reports concerning results in neuropsychiatric disorders and psychopathology and the effects of behavioral tasks, neurobiological-, psychotherapy-, and pharmacological treatments are featured. we also invite manuscripts on the methods of obtaining images and computer processing of the images themselves. reviews, meta-analysis and selected case reports are also published."
274,21100977385,"""Chronic Stress""",0.816,Q2,https://www.scimagojr.com/journalsearch.php?q=21100977385&tip=sid&clean=0,
275,17600155060,"""Cell Adhesion and Migration""",0.815,Q3,https://www.scimagojr.com/journalsearch.php?q=17600155060&tip=sid&clean=0,"cell adhesion & migration is a multi-disciplinary, peer reviewed open access journal that focuses on the biological or pathological implications of cell-cell and cell-microenvironment interactions. the main focus of this journal is fundamental science. the journal strives to serve a broad readership by regularly publishing review articles covering specific disciplines within the field, and by publishing focused issues that provide an overview on specific topics of interest within the field. 
cell adhesion & migration publishes relevant and timely original research, as well as authoritative overviews, commentaries, and perspectives, providing context for the work presented in  cell adhesion & migration and for key results published elsewhere. original research papers may cover all topics important in the field of cell-cell and cell-matrix interactions.  cell adhesion & migration also publishes articles related to cell biomechanics, biomaterial, and development of related imaging technologies."
276,21100329539,"""Journal of Eating Disorders""",0.815,Q2,https://www.scimagojr.com/journalsearch.php?q=21100329539&tip=sid&clean=0,"journal of eating disorders is the first open access, peer-reviewed journal publishing leading research in the science and clinical practice of eating disorders. it disseminates research that provides answers to the important issues and key challenges in the field of eating disorders and to facilitate translation of evidence into practice.

the journal publishes research on all aspects of eating disorders namely their epidemiology, nature, determinants, neurobiology, prevention, treatment and outcomes. the scope includes, but is not limited to anorexia nervosa, bulimia nervosa, binge eating disorder and other eating disorders. related areas such as important co-morbidities, obesity, body image, appetite, food and eating are also included. articles about research methodology and assessment are welcomed where they advance the field of eating disorders."
277,21100896922,"""Journal of Language Evolution""",0.815,Q2,https://www.scimagojr.com/journalsearch.php?q=21100896922&tip=sid&clean=0,"the journal of language evolution aims to be the venue of choice for language evolution research. language evolution is concerned with the question of how language came to be and how it came to be the way it is today. we are therefore interested in both biological evolution and cultural evolution as well as their interaction, and in all the functional constraints that determine how these processes take place. the journal is highly interdisciplinary and covers theoretical, computational, database-driven, and experimental work emerging from linguistics, (neuro-)cognitive sciences, psychology, anthropology, biology, evolutionary theory, computer sciences, philosophy, and other relevant disciplines."
278,32816,"""Neural Plasticity""",0.81,Q2,https://www.scimagojr.com/journalsearch.php?q=32816&tip=sid&clean=0,"neural plasticity is an international, interdisciplinary journal dedicated to the publication of articles related to all aspects of neural plasticity, with special emphasis on its functional significance as reflected in behavior and in psychopathology. neural plasticity publishes research and review articles from the entire range of relevant disciplines, including basic neuroscience, behavioral neuroscience, cognitive neuroscience, biological psychology, and biological psychiatry."
279,21100286315,"""Brain and Behavior""",0.809,Q2,https://www.scimagojr.com/journalsearch.php?q=21100286315&tip=sid&clean=0,"brain and behavior is peer-reviewed, open access, interdisciplinary journal, providing rapid publication of scientifically sound research across neurology, neuroscience, psychology and psychiatry. the journal publishes quality research reports that enhance understanding of the brain and behavior. the e journal strives to help authors and look for reasons to publish rather than reject. the journal's broad scope considers empirical and theoretical submissions in areas including, but not limited to

mechanisms and treatment of psychiatric disorders and neurological diseases
behavioral and cognitive science
clinical, social, developmental, and cognitive psychology
neurosurgery, neuroimaging, and neuroimmunology
epidemiology and genetics of psychological and neurological conditions
emerging technologies and new research methods 
brain and behavior gives rapid consideration to papers in all areas of clinical and basic research across a broad scope of topics in neuroscience, neurology, psychology, and psychiatry. brain and behavior features original research articles, reviews, methods papers, editorials, and commentaries. original research papers must report well-conducted research with conclusions supported by the data presented in the paper. molecular, cellular, systems and population-level research in humans and animal models are welcome. a more extensive list of keywords is listed below. terms are sorted into two categories: ""brain"" and ""behavior"". those terms most relevant to neuroscience and neurology are found under  ""brain"" and those terms most relevant to psychology and psychiatry research  are under ""behavior""."
280,12163,"""Brain and Cognition""",0.808,Q3,https://www.scimagojr.com/journalsearch.php?q=12163&tip=sid&clean=0,"brain and cognition is a forum for the integration of the neurosciences and cognitive sciences. b&c publishes peer-reviewed research articles, theoretical papers, case histories that address important theoretical issues, and historical articles into the interaction between cognitive function and brain processes. the focus is on rigorous studies of an empirical or theoretical nature and which make an original contribution to our knowledge about the involvement of the nervous system in cognition. coverage includes, but is not limited to memory, learning, emotion, perception, movement, music or praxis in relationship to brain structure or function. published articles will typically address issues relating some aspect of cognitive function to its neurological substrates with clear theoretical import, formulating new hypotheses or refuting previously established hypotheses. clinical papers are welcome if they raise issues of theoretical importance or concern and shed light on the interaction between brain function and cognitive function. we welcome review articles that clearly contribute a new perspective or integration, beyond summarizing the literature in the field; authors of review articles should make explicit where the contribution lies. we also welcome proposals for special issues on aspects of the relation between cognition and the structure and function of the nervous system. such proposals can be made directly to the editor-in-chief from individuals interested in being guest editors for such collections."
281,18073,"""NeuroToxicology""",0.805,Q2,https://www.scimagojr.com/journalsearch.php?q=18073&tip=sid&clean=0,"neurotoxicology specializes in publishing the best peer-reviewed original research papers dealing with the effects of toxic substances on the nervous system of humans and experimental animals of all ages. the journal emphasizes papers dealing with the neurotoxic effects of environmentally significant chemical hazards, manufactured drugs and naturally occurring compounds. papers dealing with the effects of neurotoxicants on other systems (e.g. reproductive, endocrine, immune) or processes (e.g. metabolic) are also welcome.

neurotoxicology will not accept papers reporting on neuroactive properties of formulations or natural products for which full chemical identification and purification information of the active molecule(s) is lacking."
282,19700175168,"""Frontiers in Computational Neuroscience""",0.797,Q2,https://www.scimagojr.com/journalsearch.php?q=19700175168&tip=sid&clean=0,"frontiers in computational neuroscience publishes rigorously peer-reviewed research that promotes theoretical modeling of brain function and fosters multidisciplinary interactions between theoretical and experimental neuroscience. specialty chief editors misha tsodyks at the weizmann institute of science and si wu at the beijing normal university are supported by an outstanding editorial board of international experts. this open-access journal is at the forefront of disseminating and communicating scientific knowledge and impactful discoveries to researchers, academics and the public worldwide.

progress in understanding the amazing capabilities of the brain is still limited, and we believe that it will only come with deep theoretical thinking and mutually stimulating cooperation between different disciplines and approaches. we therefore invite original contributions on a wide range of topics that present the fruits of such cooperation, or provide stimuli for future alliances. we aim to provide an interactive forum for cutting-edge theoretical studies of the nervous system, and for promulgating the best theoretical research to the broader neuroscience community. models of all styles and at all levels are welcome, from biophysically motivated realistic simulations of neurons and synapses to high-level abstract models of inference and decision making. while the journal is primarily focused on theoretically based and driven research, we welcome experimental studies that validate and test theoretical conclusions."
283,17500155120,"""Journal of Neuropsychology""",0.795,Q2,https://www.scimagojr.com/journalsearch.php?q=17500155120&tip=sid&clean=0,"the journal of neuropsychology publishes original contributions to scientific knowledge in neuropsychology including:

• clinical and research studies with neurological, psychiatric and psychological patient populations in all age groups
• behavioural or pharmacological treatment regimes
• cognitive experimentation and neuroimaging
• multidisciplinary approach embracing areas such as developmental psychology, neurology, psychiatry, physiology, endocrinology, pharmacology and imaging science

the following types of paper are invited:

• papers reporting original empirical investigations
• theoretical papers; provided that these are sufficiently related to empirical data
• review articles, which need not be exhaustive, but which should give an interpretation of the state of research in a given field and, where appropriate, identify its clinical implications
• brief reports and comments
• case reports
• fast-track papers (included in the issue following acceptation) reaction and rebuttals (short reactions to publications in jnp followed by an invited rebuttal of the original authors)
• special issues."
284,13820,"""Current Eye Research""",0.794,Q2,https://www.scimagojr.com/journalsearch.php?q=13820&tip=sid&clean=0,"the principal aim of current eye research is to provide rapid publication of full papers, short communications and mini-reviews, all high quality. current eye research publishes articles encompassing all the areas of eye research. subject areas include the following: clinical research, anatomy, physiology, biophysics, biochemistry, pharmacology, developmental biology, microbiology and immunology."
285,4000151608,"""Psychiatry Investigation""",0.794,Q3,https://www.scimagojr.com/journalsearch.php?q=4000151608&tip=sid&clean=0,"the psychiatry investigation is published on the 25th day of every month in english by the korean neuropsychiatric association (knpa). the journal covers the whole range of psychiatry and neuroscience. both basic and clinical contributions are encouraged from all disciplines and research areas relevant to the pathophysiology and management of neuropsychiatric disorders and symptoms, as well as researches related to cross cultural psychiatry and ethnic issues in psychiatry. the journal publishes editorials, review articles, original articles, brief reports, viewpoints and correspondences. all research articles are peer reviewed. contributions are accepted for publication on the condition that their substance has not been published or submitted for publication elsewhere. authors submitting papers to the journal (serially or otherwise) with a common theme or using data derived from the same sample (or a subset thereof) must send details of all relevant previous publications and simultaneous submissions. the journal is not responsible for statements made by contributors. material in the journal does not necessarily reflect the views of the editor or of the knpa. manuscripts accepted for publication are copy-edited to improve readability and to ensure conformity with house style."
286,19959,"""Visual Neuroscience""",0.791,Q3,https://www.scimagojr.com/journalsearch.php?q=19959&tip=sid&clean=0,"visual neuroscience is an international journal devoted to the publication of experimental and theoretical research on biological mechanisms of vision. a major goal of publication is to bring together in one journal a broad range of studies that reflect the diversity and originality of all aspects of neuroscience research relating to the visual system. contributions may address molecular, cellular or systems-level processes in either vertebrate or invertebrate species. the journal publishes work based on a wide range of technical approaches, including molecular genetics, anatomy, physiology, psychophysics and imaging, and utilizing comparative, developmental, theoretical or computational approaches to understand the biology of vision and visuo-motor control. the journal also publishes research seeking to understand disorders of the visual system and strategies for restoring vision. studies based exclusively on clinical, psychophysiological or behavioral data are welcomed, provided that they address questions concerning neural mechanisms of vision or provide insight into visual dysfunction."
287,14509,"""Journal of Vision""",0.79,Q3,https://www.scimagojr.com/journalsearch.php?q=14509&tip=sid&clean=0,"exploring all aspects of biological visual function, including spatial vision, perception,
low vision, color vision and more, spanning the fields of neuroscience, psychology and psychophysics."
288,24007,"""Physiology and Behavior""",0.788,Q2,https://www.scimagojr.com/journalsearch.php?q=24007&tip=sid&clean=0,"physiology & behavior is aimed at the causal physiological mechanisms of behavior and its modulation by environmental factors. the journal invites original reports in the broad area of behavioral and cognitive neuroscience, in which at least one variable is physiological and the primary emphasis and theoretical context are behavioral. the range of subjects includes behavioral neuroendocrinology, psychoneuroimmunology, learning and memory, ingestion, social behavior, and studies related to the mechanisms of psychopathology. contemporary reviews and theoretical articles are welcomed and the editors invite such proposals from interested authors."
289,17973,"""Neuromodulation""",0.787,Q2,https://www.scimagojr.com/journalsearch.php?q=17973&tip=sid&clean=0,"neuromodulation: technology at the neural interface is the preeminent journal in the area of neuromodulation, providing our readership with state of the art clinical, translational, and basic science research in the field. for clinicians, engineers, scientists, and members of the medical device industry alike, neuromodulation provides timely and rigorously peer-reviewed articles on the technology, science, and clinical application of devices that interface with the nervous system to treat disease, alleviate symptoms, and improve function. representing the needs of the broad neuromodulation community, the journal serves as an instrument for exchanging high-quality data, advancing science, and as a forum for debate and commentary.
neuromodulation covers an ever-expanding field including pain, headache, movement disorders, spasticity, paralysis, psychiatric and cognitive disorders, epilepsy, sensory deprivation, cardiovascular, gastrointestinal, and genitourinary disorders among others.
as the official journal of the international neuromodulation society (ins), it represents the international practice of neuromodulation, a growing, diverse multidisciplinary field responsible for the development and application of both invasive and non-invasive devices and techniques to benefit individuals by normalizing or augmenting function and reducing the impact of disease. in-depth reviews, original articles, national and international meeting abstracts, special focus editions, and web-based and social media educational offerings help the reader to expand their knowledge and understanding of the interface between electrical stimulation, chemical neuromodulation and the nervous system. our updates on past and future news of events and activities of the ins and its membership keep the reader abreast of issues related to professional education and development in this dynamic field."
290,18046,"""Neuroscience Letters""",0.783,Q2,https://www.scimagojr.com/journalsearch.php?q=18046&tip=sid&clean=0,"neuroscience letters is devoted to the rapid publication of short, high-quality papers of interest to the broad community of neuroscientists. only papers which will make a significant addition to the literature in the field will be published. papers in all areas of neuroscience - molecular, cellular, developmental, systems, behavioral and cognitive, as well as computational - will be considered for publication. submission of laboratory investigations that shed light on disease mechanisms is encouraged. special issues, edited by guest editors to cover new and rapidly-moving areas, will include invited mini-reviews. occasional mini-reviews in especially timely areas will be considered for publication, without invitation, outside of special issues; these un-solicited mini-reviews can be submitted without invitation but must be of very high quality. clinical studies will also be published if they provide new information about organization or actions of the nervous system, or provide new insights into the neurobiology of disease. nsl does not publish case reports."
291,13844,"""Documenta Ophthalmologica""",0.78,Q3,https://www.scimagojr.com/journalsearch.php?q=13844&tip=sid&clean=0,"documenta ophthalmologica is an official publication of the international society for clinical electrophysiology of vision. the purpose of the journal is to promote the understanding and application of clinical electrophysiology of vision. documenta ophthalmologica will publish reviews, research articles, technical notes, brief reports and case studies which inform the readers about basic and clinical sciences related to visual electrodiagnosis and means to improve diagnosis and clinical management of patients using visual electrophysiology. studies may involve animals or humans. in either case appropriate care must be taken to follow the declaration of helsinki for human subject or appropriate humane standards of animal care (e.g., the arvo standards on animal care and use)."
