Rank,Sourceid,Title,SJR,SJR Best Quartile,URL,Scope
143,14635,"""Ophthalmologica""",1.245,Q1,https://www.scimagojr.com/journalsearch.php?q=14635&tip=sid&clean=0,"published since 1899, ophthalmologica has become a frequently cited guide to international work in clinical and experimental ophthalmology. it contains a selection of patient-oriented contributions covering the etiology of eye diseases, diagnostic techniques, and advances in medical and surgical treatment, with special emphasis on retinal diseases. in addition to original papers, ophthalmologica features regularly timely reviews in an effort to keep the reader well informed and updated. the large international circulation of this journal reflects its importance."
144,21100854907,"""Borderline Personality Disorder and Emotion Dysregulation""",1.243,Q2,https://www.scimagojr.com/journalsearch.php?q=21100854907&tip=sid&clean=0,"borderline personality disorder and emotion dysregulation provides a platform for researchers and clinicians interested in borderline personality disorder (bpd) as a currently highly challenging psychiatric disorder. emotion dysregulation is at the core of bpd but also stands on its own as a major pathological component of the underlying neurobiology of various other psychiatric disorders. the journal focuses on the psychological, social and neurobiological aspects of emotion dysregulation as well as epidemiology, phenomenology, pathophysiology, treatment, neurobiology, genetics, and animal models of bpd. contributions investigating the broad field of emotion regulation and dysregulation as well as related pathological mechanisms such as dysfunctional self-concepts and dysfunctional social interaction are welcomed, as are studies of novel treatments for bpd. in addition, the journal considers research into the frequent, co-occurring psychiatric disorders like post-traumatic stress disorder, adhd, depression, eating disorders, conduct disorders, drug abuse, and social phobia."
145,12866,"""Cognitive, Affective and Behavioral Neuroscience""",1.235,Q1,https://www.scimagojr.com/journalsearch.php?q=12866&tip=sid&clean=0,"cognitive, affective, & behavioral neuroscience publishes theoretical, review, and primary research articles concerned with behavior and brain processes in humans, both normal participants and patients with brain injuries or processes that influence brain function, such as neurological disorders (including both healthy and disordered aging) and psychiatric disorders (e.g., schizophrenia and depression). in addition, articles that use animal models to address cognitive or affective processes involving behavioral, invasive, or imaging methods are also highly welcome. one of the main goals of cabn is to be the premier outlet for strongly psychologically motivated studies of brain–behavior relationships. thus, the editors highly encourage papers with clear integration between psychological theory and the conduct and interpretation of the neuroscientific data. articles will be appropriate to the journal if they cover: (1) topics relating to cognition, such as perception, attention, memory, language, problem solving, reasoning, and decision-making; (2) topics concerning emotional processes, motivation, reward prediction, and affective states; and (3) topics relating to individual differences in relevant domains, including personality. in all cases, the editors will give highest priority to papers that report a combination of behavioral and neuroscientific methods to address these research topics."
146,17379,"""Molecular and Cellular Neurosciences""",1.229,Q2,https://www.scimagojr.com/journalsearch.php?q=17379&tip=sid&clean=0,"molecular and cellular neuroscience publishes original research of high significance covering all aspects of neurosciences indicated by the broadest interpretation of the journal's title. in particular, the journal focuses on synaptic maintenance, de- and re-organization, neuron-glia communication, and de-/regenerative neurobiology. in addition, studies using animal models of disease with translational prospects and experimental approaches with backward validation of disease signatures from human patients are welcome.

furthermore, since rapid peer-review and publication of such research is of paramount importance, extended cycles of article revision and re-review will not be entered into; it is anticipated that authors will fully address all referees' comments during the course of a single revision of their original manuscript."
147,16246,"""Journal of Alzheimer's Disease""",1.225,Q2,https://www.scimagojr.com/journalsearch.php?q=16246&tip=sid&clean=0,"the journal of alzheimer's disease (jad) is an international multidisciplinary journal to facilitate progress in understanding the etiology, pathogenesis, epidemiology, genetics, behavior, treatment and psychology of alzheimer's disease. the journal publishes research reports, reviews, short communications, hypotheses, ethics reviews, book reviews, and letters-to-the-editor. the journal is dedicated to providing an open forum for original research that will expedite our fundamental understanding of alzheimer's disease."
148,19700175115,"""Frontiers in Systems Neuroscience""",1.223,Q2,https://www.scimagojr.com/journalsearch.php?q=19700175115&tip=sid&clean=0,"frontiers in systems neuroscience publishes rigorously peer-reviewed research that advances our understanding of whole systems of the brain, including those involved in sensation, movement, learning and memory, attention, reward, decision-making, reasoning, executive functions, and emotions."
149,15546,"""European Archives of Psychiatry and Clinical Neuroscience""",1.222,Q2,https://www.scimagojr.com/journalsearch.php?q=15546&tip=sid&clean=0,"the original papers published in the european archives of psychiatry and clinical neuroscience deal with all aspects of psychiatry and related clinical neuroscience.
clinical psychiatry, psychopathology, epidemiology as well as brain imaging, neuropathological, neurophysiological, neurochemical and moleculargenetic studies of psychiatric disorders are among the topics covered.
thus both the clinician and the neuroscientist are provided with a handy source of information on important scientific developments."
150,24782,"""Neural Computation""",1.213,Q2,https://www.scimagojr.com/journalsearch.php?q=24782&tip=sid&clean=0,"neural computation is uniquely positioned at the crossroads between neuroscience and tmcs and welcomes the submission of original papers from all areas of tmcs, including: advanced experimental design; analysis of chemical sensor data; connectomic reconstructions; analysis of multielectrode and optical recordings; genetic data for cell identity; analysis of behavioral data; multiscale models; analysis of molecular mechanisms; neuroinformatics; analysis of brain imaging data; neuromorphic engineering; principles of neural coding, computation, circuit dynamics, and plasticity; theories of brain function."
151,21100386467,"""Sleep Health""",1.213,Q1,https://www.scimagojr.com/journalsearch.php?q=21100386467&tip=sid&clean=0,"sleep health journal of the national sleep foundation is a multidisciplinary journal that explores sleep's role in population health and elucidates the social science perspective on sleep and health. aligned with the national sleep foundation's global authoritative, evidence-based voice for sleep health, the journal serves as the foremost publication for manuscripts that advance the sleep health of all members of society.the scope of the journal extends across diverse sleep-related fields, including anthropology, education, health services research, human development, international health, law, mental health, nursing, nutrition, psychology, public health, public policy, fatigue management, transportation, social work, and sociology. the journal welcomes original research articles, review articles, brief reports, special articles, letters to the editor, editorials, and commentaries."
152,21100464901,"""Neurophotonics""",1.209,Q2,https://www.scimagojr.com/journalsearch.php?q=21100464901&tip=sid&clean=0,"novel optical technologies for imaging and manipulation of brain structure and function span from visualization of intracellular organelles and protein assemblies to noninvasive macroscopic investigation of cortical activity in human subjects. the methods and applications are growing rapidly and are driving profound advances in understanding brain phenomena such as electrical excitability, neuroglial partnership, neurovascular signaling, metabolic activity, and hemodynamics in health and disease. at the interface of optics and neuroscience, neurophotonics covers advances in optical technology applicable to study of the brain and their impact on the basic and clinical neuroscience applications. neurophotonics publishes peer-reviewed papers on a broad range of topics highlighting the impact of novel optical methods in the neurosciences including:


microscopic methods,
super-resolution nanoscopic methods,
optogenetics and other optical methods of manipulating cellular behavior,
synthetic and genetically encoded optical reporters and actuators,
optical clearing methods,
methods to investigate neuroglial and vascular physiology,
methods to investigate cellular energetics,
noninvasive methods of measuring and imaging brain function and physiology,
photoacoustic methods spanning from optical to acoustic resolution,
clinical and translation applications,
computational methods relevant to understanding and interpreting optical measurements."
153,12874,"""Cognitive Science""",1.202,Q2,https://www.scimagojr.com/journalsearch.php?q=12874&tip=sid&clean=0,"the following kinds of articles are appropriate for the journal: (a) theories or theoretical analyses of knowledge representation, cognitive processes, and brain theory; (b) experimental or ethnographic studies relevant to theoretical issues in cognitive science; (c) descriptions of intelligent programs that exhibit or model some human ability; (d) design proposals for cognitive models; (e) protocol or discourse analysis of human cognitive processing; (f) discussions of new problem areas or methodological issues in cognitive science; and (g) short theoretical notes or rebuttals. the journal will publish four categories of articles."
154,21100900324,"""Epilepsia Open""",1.194,Q1,https://www.scimagojr.com/journalsearch.php?q=21100900324&tip=sid&clean=0,"epilepsia open is the new open access journal of the international league against epilepsy (ilae). the primary aim of epilepsia open is to rapidly publish robust high quality results that provide insights in all aspects of epilepsy research. specifically, epilepsia open will publish peer reviewed, high quality open access articles covering the entire breadth of basic, translational and clinical research in epilepsy. the spectrum of articles may include all disciplines of life and health sciences, such as public/global health science and societal impact studies. epilepsia open also welcomes submissions of high quality research with confirmatory results, failure-to-confirm studies, and negative results or interesting study protocols for testing new treatments. epilepsia open will publish communications from the ilae and its chapters. a priority is also given to commentaries of issues and concepts that enhance the access and application of basic research findings for clinical scientists and health professionals, and promote a better understanding of clinical challenges for biomedical researchers. epilepsia open is creating a unique forum for the reputable and speedy open access publication of epilepsy research. we are committed to facilitating and invigorating a robust and successful pipeline for improved human health science in epilepsy."
155,33648,"""Neurorehabilitation and Neural Repair""",1.188,Q1,https://www.scimagojr.com/journalsearch.php?q=33648&tip=sid&clean=0,"the journal will consider for publication original articles and reviews on both basic science and clinical research relevant to recovery from neural injury. examples of appropriate topics include cortical remodeling, mechanisms of sprouting and regeneration, the development of cell lines for transplantation and trophic factor replacement, strategies to promote functional recovery in human patients, design of outcome measures in neurologic rehabilitation, the multidisciplinary management of neurologic disease, and bioengineering and assistive devices used in the management of neurologic impairment."
156,23475,"""Journal of Neurophysiology""",1.186,Q2,https://www.scimagojr.com/journalsearch.php?q=23475&tip=sid&clean=0,"the journal of neurophysiology publishes original articles on the function of the nervous system. all levels of function are included, from the membrane and cell to systems and behavior. experimental approaches include molecular neurobiology, cell culture and slice preparations, membrane physiology, developmental neurobiology, functional neuroanatomy, neurochemistry, neuropharmacology, systems electrophysiology, imaging and mapping techniques, and behavioral analysis. experimental preparations may be invertebrate or vertebrate species, including humans. theoretical studies are acceptable if they are tied closely to the interpretation of experimental data and elucidate principles of broad interest."
157,15550,"""European Journal of Neuroscience""",1.183,Q2,https://www.scimagojr.com/journalsearch.php?q=15550&tip=sid&clean=0,"ejn is the journal of fens and supports the international neuroscientific community by publishing original high quality research articles and reviews in all fields of neuroscience. in addition, to engage with issues that are of interest to the science community, we also publish editorials, meetings reports and neuro-opinions on topics that are of current interest in the fields of neuroscience research and training in science. we have recently established a series of ‘profiles of women in neuroscience’. our goal is to provide a vehicle for publications that further the understanding of the structure and function of the nervous system in both health and disease and to provide a vehicle to engage the neuroscience community. as the official journal of fens, profits from the journal are re-invested in the neuroscientific community through the activities of fens."
158,19700174918,"""Clinical and Translational Science""",1.162,Q2,https://www.scimagojr.com/journalsearch.php?q=19700174918&tip=sid&clean=0,"clinical and translational science (cts), an official journal of the american society for clinical pharmacology and therapeutics, highlights original translational medicine research that helps bridge laboratory discoveries with the diagnosis and treatment of human disease. translational medicine is a multi-faceted discipline with a focus on translational therapeutics. in a broad sense, translational medicine bridges across the discovery, development, regulation, and utilization spectrum. research may appear as full articles, brief reports, commentaries, phase forwards (clinical trials), reviews, or tutorials. cts also includes invited didactic content that covers the connections between clinical pharmacology and translational medicine. best-in-class methodologies and best practices are also welcomed as tutorials. these additional features provide context for research articles and facilitate understanding for a wide array of individuals interested in clinical and translational science. cts welcomes high quality, scientifically sound, original manuscripts focused on clinical pharmacology and translational science, including animal, in vitro, in silico, and clinical studies supporting the breadth of drug discovery, development, regulation and clinical use of both traditional drugs and innovative modalities."
159,25678,"""Journal of Research on Adolescence""",1.146,Q1,https://www.scimagojr.com/journalsearch.php?q=25678&tip=sid&clean=0,"jra seeks to publish innovative and rigorous research that advances understanding of adolescent development. the journal considers manuscripts from the wide range of topics relevant to adolescent development, using rigorous quantitative or qualitative methodologies, and considering samples during the second decade of life (though samples of university students aged about 18-20 years need a strong justification that the sample is not one of convenience). manuscripts should advance understanding of adolescent development, rather than merely study a phenomenon with an adolescent sample, and should therefore be grounded in developmental theory and prior developmental research. there are no exclusions of particular methodologies, though studies including a diverse and representative sample, with valid and multiple information sources, and/or with best practice quantitative or qualitative analysis strategies are preferred. manuscripts should clearly articulate the advances in understanding adolescent development and the applications for improving the lives of adolescents."
160,19700172804,"""ACS Chemical Neuroscience""",1.14,Q2,https://www.scimagojr.com/journalsearch.php?q=19700172804&tip=sid&clean=0,"acs chemical neuroscience publishes high-quality research articles and reviews that showcase chemical, quantitative biological, biophysical and bioengineering approaches to the understanding of the nervous system and to the development of new treatments for neurological disorders. research in the journal focuses on aspects of chemical neurobiology and bio-neurochemistry such as the following:

neurotransmitters and receptors
neuropharmaceuticals and therapeutics
neural development—plasticity, and degeneration
chemical, physical, and computational methods in neuroscience
neuronal diseases—basis, detection, and treatment
mechanism of aging, learning, memory and behavior
pain and sensory processing
neurotoxins
neuroscience-inspired bioengineering
development of methods in chemical neurobiology
neuroimaging agents and technologies
animal models for central nervous system diseases
behavioral research"
161,18009,"""Neuropsychologia""",1.14,Q1,https://www.scimagojr.com/journalsearch.php?q=18009&tip=sid&clean=0,"neuropsychologia is an international interdisciplinary journal devoted to experimental and theoretical contributions that advance understanding of human cognition and behavior from a neuroscience perspective. the journal will consider for publication studies that directly link brain function with cognitive processes, including perception, attention and consciousness, action and motor control, executive functions and cognitive control, memory, language, and emotion and social cognition. submission of papers using methodologies such as functional and structural neuroimaging, cognitive electrophysiology, and brain stimulation to significantly advance cognitive and psychological theory is strongly encouraged.

neuropsychologia has a long history of publishing lesion-deficit studies, and these remain highly appropriate for the journal. submission animal studies are also welcome, provided they have a direct and explicitly specified impact on understanding the brain basis of human cognition and behavior. studies that employ a purely behavioral approach in neurologically healthy participants are not appropriate for the journal unless the findings have a direct and significant bearing on the understanding of the neural mechanisms or systems supporting cognition and behavior. studies of clinical populations that are primarily descriptive or intended to elucidate a clinical disorder, or that evaluate a therapeutic intervention, are not appropriate for the journal. special issues and review papers are published regularly with the aim of providing authoritative surveys of topics of major interest."
162,145178,"""American Journal of Medical Genetics, Part B: Neuropsychiatric Genetics""",1.132,Q2,https://www.scimagojr.com/journalsearch.php?q=145178&tip=sid&clean=0,"neuropsychiatric genetics, part b of the american journal of medical genetics (ajmg) , provides a forum for experimental and clinical investigations of the genetic, epigenetic, and protein signaling mechanisms underlying neurologic and psychiatric disorders. it is a resource for novel genetics studies of the heritable nature of psychiatric and other nervous system disorders, characterized at the molecular, cellular, or behavioral levels. neuropsychiatric genetics publishes eight times per year."
163,16766,"""Journal of Neuroscience Research""",1.114,Q2,https://www.scimagojr.com/journalsearch.php?q=16766&tip=sid&clean=0,"the journal of neuroscience research (jnr) publishes novel research results that will advance our understanding of the development, function and pathophysiology of the nervous system, using molecular, cellular, systems, and translational approaches. jnr covers both basic research and clinical aspects of neurology, neuropathology, psychiatry or psychology.

the journal focuses on uncovering the intricacies of brain structure and function. research published in jnr covers all species from invertebrates to humans, and the reports inform the readers about the function and organization of the nervous system, with emphasis on how disease modifies the function and organization."
164,19700175167,"""Frontiers in Neuroinformatics""",1.111,Q2,https://www.scimagojr.com/journalsearch.php?q=19700175167&tip=sid&clean=0,"frontiers in neuroinformatics publishes rigorously peer-reviewed research on the development and implementation of numerical/computational models and analytical tools used to share, integrate and analyze experimental data and advance theories of the nervous system functions. specialty chief editors jan g. bjaalie at the university of oslo and sean l. hill at the école polytechnique fédérale de lausanne are supported by an outstanding editorial board of international experts. this multidisciplinary open-access journal is at the forefront of disseminating and communicating scientific knowledge and impactful discoveries to researchers, academics and the public worldwide.

neuroscience is being propelled into the information age as the volume of information explodes, demanding organization and synthesis. novel synthesis approaches are opening up a new dimension for the exploration of the components of brain elements and systems and the vast number of variables that underlie their functions. neural data is highly heterogeneous with complex inter-relations across multiple levels, driving the need for innovative organizing and synthesizing approaches from genes to cognition, and covering a range of species and disease states.

frontiers in neuroinformatics therefore welcomes submissions on existing neuroscience databases, development of data and knowledge bases for all levels of neuroscience, applications and technologies that can facilitate data sharing (interoperability, formats, terminologies, and ontologies), and novel tools for data acquisition, analyses, visualization, and dissemination of nervous system data. our journal welcomes submissions on new tools (software and hardware) that support brain modeling, and the merging of neuroscience databases with brain models used for simulation and visualization."
165,22138,"""Genes, Brain and Behavior""",1.105,Q1,https://www.scimagojr.com/journalsearch.php?q=22138&tip=sid&clean=0,"genes, brain and behavior was launched in 2002 with the aim of publishing top quality research in behavioral and neural genetics in their broadest sense. the emphasis is on the analysis of the behavioral and neural phenotypes under consideration, the unifying theme being the genetic approach as a tool to increase our understanding of these phenotypes.

genes brain and behavior is pleased to offer the following features: 

8 issues per year
online submissions with first editorial decisions within 3-4 weeks and fast publication at wiley-blackwells
high visibility through its coverage by pubmed/medline, current contents and other major abstracting and indexing services
inclusion in the wiley-blackwell consortial license, extending readership to thousands of international libraries and institutions
a large and varied editorial board comprising of international specialists."
