Rank,Sourceid,Title,SJR,SJR Best Quartile,URL,Scope
1,17436,"""Nature Neuroscience""",12.017,Q1,https://www.scimagojr.com/journalsearch.php?q=17436&tip=sid&clean=0,"nature neuroscience is a multidisciplinary journal that publishes papers of the highest quality and significance in all areas of neuroscience. the editors welcome contributions in molecular, cellular, systems and cognitive neuroscience, as well as psychophysics, computational modeling and diseases of the nervous system. no area is excluded from consideration, although priority is given to studies that provide fundamental insights into the functioning of the nervous system.

nature neuroscience provides readers and authors high visibility, emphasis on interdisciplinary communication, accessibility to a broad readership, high standards of copy editing and production, rigorous peer review, rapid publication, and independence from academic societies and other vested interests.

in addition to primary research, nature neuroscience publishes news and views, reviews, editorials, commentaries, perspectives, book reviews and correspondence. in this way, the journal aims to be the voice of the worldwide neuroscience community."
2,21100356804,"""Lancet Psychiatry,The""",8.932,Q1,https://www.scimagojr.com/journalsearch.php?q=21100356804&tip=sid&clean=0,"we publish original research, reviews, and personal views, as well as timely news and comment about all aspects of psychiatry. topics considered by the journal include psychopharmacology, psychotherapy, and psychosocial approaches to all psychiatric disorders, across the life course. the journal covers innovative treatments and the biological research underpinning such developments, novel methods of service delivery, and new ways of thinking about mental illness promoted by social psychiatry. the journal also advocates strongly for the rights of people with mental illnesses, and welcome the voices of service users."
3,17437,"""Nature Reviews Neuroscience""",7.944,Q1,https://www.scimagojr.com/journalsearch.php?q=17437&tip=sid&clean=0,"neuroscience is the archetypal multidisciplinary science encompassing a variety of fields that share the common goal of attempting to provide a complete understanding of the structure and function of the central nervous system. a series of advances in molecular, developmental and cognitive neuroscience, stimulated by the advent of powerful new experimental techniques and theoretical approaches, have now rendered some of the most enduring neurobiological questions increasingly tractable. this explosion of knowledge has in turn created a need for new tools to efficiently organize and communicate this information. nature reviews neuroscience covers the breadth and depth of modern neuroscience by providing an authoritative, accessible, topical, and engaging first port of call for scientists who are interested in all aspects of neuroscience.

subjects covered
cellular and molecular neuroscience
development of the nervous system
sensory, motor systems and behaviour
regulatory systems
higher cognition and language
computational neuroscience
disorders of the brain."
4,17700156408,"""Nature Reviews Neurology""",7.736,Q1,https://www.scimagojr.com/journalsearch.php?q=17700156408&tip=sid&clean=0,"nature reviews' clinical content is written by internationally renowned clinical academics and researchers and targeted towards readers in the medical sciences, from postgraduate level upwards. while intended to be read by practicing doctors, researchers and academics within a specialty, we aim to make all our articles accessible to readers working in any medical discipline.

in-depth reviews present authoritative, up-to-date information on a topic, placing it in the context of a field's history and development. topical discussion and opinions are proffered in perspectives and news & views articles, and in the research highlights section we filter primary research from a range of specialty and general medical journals."
5,17978,"""Neuron""",7.556,Q1,https://www.scimagojr.com/journalsearch.php?q=17978&tip=sid&clean=0,"neuron has established itself as one of the most influential and relied upon journals in the field of neuroscience. the editors embrace interdisciplinary strategies that integrate biophysical, cellular, developmental, and molecular approaches with a systems approach to sensory, motor, and higher-order cognitive functions. neuron serves as one of the premier intellectual forums of the entire neuroscience community."
6,14181,"""Annual Review of Neuroscience""",7.269,Q1,https://www.scimagojr.com/journalsearch.php?q=14181&tip=sid&clean=0,"the annual review of neuroscience, in publication since 1978, covers the significant developments across the entire field of neuroscience, including molecular and cellular neuroscience, neurogenetics, development, plasticity and repair, systems neuroscience, cognitive neuroscience, behavior, and neurobiology of disease, with occasional reviews in history of neuroscience and ethics."
7,15359,"""Trends in Cognitive Sciences""",6.222,Q1,https://www.scimagojr.com/journalsearch.php?q=15359&tip=sid&clean=0,"essential reading for those working directly in the cognitive sciences or in related specialist areas, trends in cognitive sciences provides an instant overview of current thinking for scientists, students and teachers who want to keep up with the latest developments in the cognitive sciences. the journal brings together research in psychology, artificial intelligence, linguistics, philosophy, computer science and neuroscience. trends in cognitive sciences provides a platform for the interaction of these disciplines and the evolution of cognitive science as an independent field of study."
8,15090,"""Progress in Retinal and Eye Research""",6.022,Q1,https://www.scimagojr.com/journalsearch.php?q=15090&tip=sid&clean=0,"by invitation leading experts write on basic and clinical aspects of the eye in a style appealing to molecular biologists, neuroscientists and physiologists, as well as to vision researchers and ophthalmologists.

the journal covers all aspects of eye research, including topics pertaining to the retina and pigment pithelial layer, cornea, tears, lacrimal glands, aqueous humour, iris, ciliary body, trabeculum, lens, vitreous humour and diseases such as dry-eye, inflammation, keratoconus, corneal dystrophy, glaucoma and cataract."
9,17435,"""EMBO Journal""",5.633,Q1,https://www.scimagojr.com/journalsearch.php?q=17435&tip=sid&clean=0,"the embo journal publishes papers describing original research of broad general interest in molecular and cell biology - a particular emphasis is placed on molecular mechanism and physiological relevance.

the journal encourages and publishes articles that report novel findings of wide biological significance in the areas of: ageing; autophagy; cancer; cell adhesion, polarity & cytoskeleton; cell cycle; cell death; developmental biology; dna replication, repair & recombination; chromatin, epigenetics & genomics; immunology; membrane & intracellular transport; metabolism; microbiology, virology & host pathogen interaction; molecular biology of disease; neuroscience; plant biology; post-translational modifications, proteolysis & proteomics; rna biology; signal transduction; stem cells; structural biology; systems, chemical & computational biology; transcription; protein biosynthesis & quality control; vascular biology"
10,21100838541,"""Nature Human Behaviour""",5.205,Q1,https://www.scimagojr.com/journalsearch.php?q=21100838541&tip=sid&clean=0,"drawing from a broad spectrum of social, biological, health, and physical science disciplines, nature human behaviour publishes research of outstanding significance into any aspect of individual or collective human behaviour. how do humans perceive, think, feel, decide, and act? how do they interact with their environments and others? how do these abilities develop and decline over the lifespan? how do they evolve and compare with other species? how do they vary among individuals, groups, and cultures? how are they shaped by socioeconomic and political factors? how are they affected by disease or deprivation? what interventions can influence individual behaviours or outcomes? the journal welcomes research from any discipline that provides significant original insight into these questions.

nature human behaviour features a broad range of topics, including (but not limited to) perception, action, memory, learning, reward, judgment, decision-making, language, communication, emotion, personality, social cognition, social behaviour, neuropsychiatric/neurodevelopmental/neurological disorders, economic & political behaviour, belief systems, social networks, social norms, social structures, behaviour change, collective cognition and behaviour, culture, public policy.

in addition to publishing original research, nature human behaviour publishes reviews, perspectives, comments, news, features, and correspondence from across the full range of disciplines concerned with human behaviour."
11,17552,"""Acta Neuropathologica""",5.203,Q1,https://www.scimagojr.com/journalsearch.php?q=17552&tip=sid&clean=0,"acta neuropathologica aims to publish the best papers on pathology of neurological disease, as well as experimental studies on molecular and cellular mechanisms using in vitro and in vivo models, ideally validated by analysis of human tissues.

the journal publishes original papers, review articles, case reports, and scientific correspondence (letters).

manuscripts submitted for publication must contain a statement to the effect that all human studies have been reviewed by the appropriate ethics committee and have therefore been performed in accordance with the ethical standards laid down in an appropriate version of the 1964 declaration of helsinki. it should also be stated clearly in the text that all persons gave their informed consent prior to their inclusion in the study. details that might disclose the identiy of the subjects under study should be omitted.

reports of animal experiments must state that the ""principles of laboratory animal care"" (nih publication no. 86-23, revised 1985) were followed, as well as specific national laws (e.g. the current version of the german law on the protection of animals) where applicable.

the editors reserve the right to reject manuscripts that do not comply with the above-mentioned requirements. the author will be held responsible for false statements or for failure to fulfil the above-mentioned requirements."
12,3600148102,"""Alzheimer's and Dementia""",5.059,Q1,https://www.scimagojr.com/journalsearch.php?q=3600148102&tip=sid&clean=0,"the mission of alzheimer & dementia: journal of the alzheimer association is to bridge the knowledge gaps across a wide range of bench-to-bedside investigation. the journal publishes the results of studies in: behavior, biochemistry, genetics, molecular biology, pharmacology, physiology, protein chemistry, neurology, neuropathology, psychiatry, geriatrics, neuropsychology, epidemiology, sociology, health services research, health economics, political science and public policy. content emphasizes interdisciplinary investigations, integrative/translational articles, related to: etiology, risk factors, early detection, disease modifying interventions, prevention of dementia and applications of new technologies in health services."
13,21100242814,"""eLife""",4.752,Q1,https://www.scimagojr.com/journalsearch.php?q=21100242814&tip=sid&clean=0,"elife welcomes the submission of research articles, short reports, tools and resources articles, research advances, scientific correspondence and review articles in the subject areas below. biochemistry and chemical biology; cancer biology; cell biology; chromosomes and gene expression; computational and systems biology; developmental biology; ecology; epidemiology and global health; evolutionary biology; genetics and genomics; human biology and medicine; immunology and inflammation; microbiology and infectious disease; neuroscience; physics of living systems; plant biology; stem cells and regenerative medicine; structural biology and molecular biophysics"
14,5700191214,"""Molecular Neurodegeneration""",4.731,Q1,https://www.scimagojr.com/journalsearch.php?q=5700191214&tip=sid&clean=0,"molecular neurodegeneration is an open access, peer-reviewed journal that encompasses all aspects of neurodegeneration research at the molecular and cellular levels.

neurodegenerative diseases collectively refer to neurological disorders that result from neurodegeneration and include, but are not limited to, alzheimer's disease, parkinson's disease, huntington's disease, and prion diseases. these diseases, which are often associated with advanced aging and display varying degrees of dementia, have become a significant public health issue as humans live longer and the aging population grows larger. recent advances in the molecular and cellular mechanisms underlying the pathogenesis of these neurodegenerative disorders have allowed for a better understanding of the disease mechanisms."
15,17382,"""Molecular Psychiatry""",4.39,Q1,https://www.scimagojr.com/journalsearch.php?q=17382&tip=sid&clean=0,"molecular psychiatry publishes work aimed at elucidating biological mechanisms underlying psychiatric disorders and their treatment. the emphasis is on studies at the interface of pre-clinical and clinical research, including studies at the cellular, molecular, integrative, clinical, imaging and psychopharmacology levels."
16,14308,"""Biological Psychiatry""",4.224,Q1,https://www.scimagojr.com/journalsearch.php?q=14308&tip=sid&clean=0,"biological psychiatry is the official journal of the society of biological psychiatry, whose purpose is to promote excellence in scientific research and education in fields that investigate the nature, causes, mechanisms and treatments of disorders of thought, emotion, or behavior. in accord with this mission, this peer-reviewed, rapid-publication, international journal publishes both basic and clinical contributions from all disciplines and research areas relevant to the pathophysiology and treatment of major psychiatric disorders.

the journal publishes novel results of original research which represent an important new lead or significant impact on the field, particularly those addressing genetic and environmental risk factors, neural circuitry and neurochemistry, and important new therapeutic approaches. reviews and commentaries that focus on topics of current research and interest are also encouraged."
17,19939,"""Trends in Neurosciences""",4.068,Q1,https://www.scimagojr.com/journalsearch.php?q=19939&tip=sid&clean=0,"for over four decades, trends in neurosciences (tins) has been a prominent source of inspiring reviews and commentaries across all disciplines of neuroscience. tins is a monthly, peer-reviewed journal, and its articles are curated by the editor and authored by leading researchers in their respective fields. the journal communicates exciting advances in brain research, serves as a voice for the global neuroscience community, and highlights the contribution of neuroscientific research to medicine and society."
18,12977,"""PLoS Biology""",3.928,Q1,https://www.scimagojr.com/journalsearch.php?q=12977&tip=sid&clean=0,"plos biology is the flagship plos journal in the life sciences and features works of exceptional significance, originality, and relevance in all areas of biological science and at every scale; from molecules to ecosystems, including works at the interface of other disciplines. we also welcome data-driven meta-research articles that evaluate and aim to improve the standards of research in the life sciences and beyond.

we evaluate research based on the important questions it answers as well as its potential to impact an international scientific community as well as educators, policy makers, patient advocacy groups, and society more broadly."
19,14179,"""Annals of Neurology""",3.876,Q1,https://www.scimagojr.com/journalsearch.php?q=14179&tip=sid&clean=0,"the annals of neurology publishes articles of broad interest in neurology, particularly those with high impact in understanding the mechanisms and treatment of diseases of the human nervous system. although annals publishes papers using a wide variety of clinical and basic neuroscience methods, we are most interested in those manuscripts that will be of general interest to academic neurologists, including clinical trials and other large-scale studies that inform the practice of medicine. purely basic studies, without strong clinical or translational potential, are unlikely to have sufficient priority for publication."
20,14992,"""Current Opinion in Neurobiology""",3.563,Q1,https://www.scimagojr.com/journalsearch.php?q=14992&tip=sid&clean=0,"current opinion in neurobiology publishes short annotated reviews by leading experts on recent developments in the field of neurobiology. these experts write short reviews describing recent discoveries in this field (in the past 2-5 years), as well as highlighting select individual papers of particular significance.

the journal is thus an important resource allowing researchers and educators to quickly gain an overview and rich understanding of complex and current issues in the field of neurobiology. the journal takes a unique and valuable approach in focusing each special issue around a topic of scientific and/or societal interest, and then bringing together leading international experts studying that topic, embracing diverse methodologies and perspectives.

journal content: the journal consists of 6 issues per year, covering 8 recurring topics every other year in the following categories:

-neurobiology of disease-
neurobiology of behavior-
cellular neuroscience-
systems neuroscience-
developmental neuroscience-
neurobiology of learning and plasticity-
molecular neuroscience-
computational neuroscience"
21,20618,"""Stroke""",3.245,Q1,https://www.scimagojr.com/journalsearch.php?q=20618&tip=sid&clean=0,"a journal of cerebral circulation publishes reports of clinical and basic investigation of any aspect of the cerebral circulation and its diseases from many disciplines, including anesthesiology, critical care medicine, epidemiology, internal medicine, neurology, neuro-ophthalmology, neuropathology, neuropsychology, neurosurgery, nuclear medicine, nursing, radiology, rehabilitation, speech pathology, vascular physiology, and vascular surgery."
22,24025,"""Progress in Neurobiology""",3.052,Q1,https://www.scimagojr.com/journalsearch.php?q=24025&tip=sid&clean=0,"progress in neurobiology is an international journal that publishes groundbreaking original research, comprehensive review articles and opinion pieces written by leading researchers. the journal welcomes contributions from the broad field of neuroscience that apply neurophysiological, biochemical, pharmacological, molecular biological, anatomical, computational and behavioral analyses to problems of molecular, cellular, developmental, systems, and clinical neuroscience."
23,20695,"""Brain, Behavior, and Immunity""",3.046,Q1,https://www.scimagojr.com/journalsearch.php?q=20695&tip=sid&clean=0,"brain, behavior, and immunity, founded in 1987, is the official journal of the psychoneuroimmunology research society (pnirs). this innovative journal publishes peer-reviewed basic, experimental, and clinical studies dealing with behavioral, neural, endocrine, and immune system interactions in humans and animals. it is an international, interdisciplinary journal devoted to original research in neuroscience, immunology, integrative physiology, behavioral biology, psychiatry, psychology, and clinical medicine and is inclusive of research at the molecular, cellular, social, and whole organism level."
24,19837,"""Sleep Medicine Reviews""",2.912,Q1,https://www.scimagojr.com/journalsearch.php?q=19837&tip=sid&clean=0,"sleep medicine reviews provides international coverage of sleep disorders, their aetiology, diagnosis, treatment and implications for related conditions at an individual and public health level.

articles review the clinical information published in peer-reviewed journals devoted to the many disciplines involved in sleep medicine, including: pulmonology, psychiatry, psychology, physiology, otolaryngology, paediatrics, geriatrics, cardiology, dentistry, nursing, neurology and general medicine.

the journal publishes narrative reviews, systematic reviews and editorials covering area of controversy and debate, as well as areas of future research."
25,15537,"""Current Biology""",2.905,Q1,https://www.scimagojr.com/journalsearch.php?q=15537&tip=sid&clean=0,"current biology is a general journal that publishes original research across all areas of biology together with an extensive and varied set of editorial sections. a primary aim of the journal is to foster communication across fields of biology, both by publishing important findings of general interest from diverse fields and through highly accessible editorial articles that explicitly aim to inform non-specialists.

current biology publishes papers reporting findings in any area of biology that have sufficient claim to be of general interest—this could be, for example, because the advance is important for a specific field, or because it is intrinsically of wide interest to biologists generally. we have several formats for publishing original research (articles, reports, and correspondences); see our information for authors for details."
26,24804,"""Neural Networks""",2.781,Q1,https://www.scimagojr.com/journalsearch.php?q=24804&tip=sid&clean=0,"neural networks is the archival journal of the world's three oldest neural modeling societies: the international neural network society (inns), the european neural network society (enns), and the japanese neural network society (jnns). a subscription to the journal is included with membership in each of these societies.

neural networks provides a forum for developing and nurturing an international community of scholars and practitioners who are interested in all aspects of neural networks and related approaches to computational intelligence. neural networks welcomes high quality submissions that contribute to the full range of neural networks research, from behavioral and brain modeling, learning algorithms, through mathematical and computational analyses, to engineering and technological applications of systems that significantly use neural network concepts and techniques. this uniquely broad range facilitates the cross-fertilization of ideas between biological and technological studies, and helps to foster the development of the interdisciplinary community that is interested in biologically-inspired computational intelligence. accordingly, neural networks editorial board represents experts in fields including psychology, neurobiology, computer science, engineering, mathematics, and physics. the journal publishes articles, letters and reviews, as well as letters to the editor, editorials, current events, software surveys, and patent information. articles are published in one of five sections: cognitive science, neuroscience, learning systems, mathematical and computational analysis, engineering and applications."
27,17495,"""NeuroImage""",2.746,Q1,https://www.scimagojr.com/journalsearch.php?q=17495&tip=sid&clean=0,"neuroimage, a journal of brain function, provides a vehicle for communicating important advances in the use of neuroimaging to study structure-function and brain-behavior relationships. though the emphasis is on the macroscopic level of human brain organization, meso-and microscopic neuroimaging across all species will be considered if they provide advances that are of relevance to a systems-level understanding of the human brain.

the main criterion on which papers are judged for neuroimage, is to what extent the scientific contribution helps advance our understanding of brain function, organization, and structure. neuroimage, also welcomes papers that explicitly address these questions in animal models or clinical populations. papers that do not contain significant methodological development, and whose major contribution is to use imaging to advance the understanding of pathology, abnormal development, use of biomarkers or other questions of clinical utility should be referred to neuroimage: clinical.

neuroimage, publishes original research articles, papers on methods, models of brain function, as well as positions on contentious issues. the journal strives to incorporate theoretical and technological innovations and is committed to publishing the highest quality papers in both print and electronic media. the editors and the editorial board members come from highly diverse specialties, reflecting the fact that imaging neuroscience is a multi-disciplinary science."
28,16764,"""Journal of Neuroscience""",2.691,Q1,https://www.scimagojr.com/journalsearch.php?q=16764&tip=sid&clean=0,"to advance neuroscience research by publishing and widely disseminating the highly rigorous research representative of the breadth of neuroscience; to ensure the peer review system remains rapid and fair; and to provide outlets for discussion of neuroscience that are not available elsewhere, allowing for competing ideas, debate, and questions around neuroscience.

jneurosci is a multidisciplinary journal that publishes papers on a broad range of topics of general interest to those working on the nervous system."
